{
  "schema": "chromalect.ontology.v1",
  "version": "1.0.0",
  "namespace": "https://sguzman.github.io/chromalect/ontology/ontology-v1.json#",
  "project": "Chromalect",
  "scope": "Visual encoding of linguistic information across languages and writing systems; Mandarin is the first implementation.",
  "publication": "public",
  "status": "initial_formal_vocabulary_not_complete_linguistic_database",
  "designPrinciples": [
    "Language and script are distinct; no writing system is presumed to consist of Chinese components.",
    "Character identity, glyph geometry, orthographic segmentation, phoneme, and pronunciation are not interchangeable.",
    "An encoding scheme maps an explicitly typed linguistic target to a reversible presentation without rewriting source text.",
    "An instance carries one v0.4 component identity irrespective of its character context; a role is contextual.",
    "Citation readings and contextual readings have separate evidence and neither implies the other.",
    "A source-aligned geometric mapping is not independent visual or linguistic certification.",
    "Unknown facts and competing analyses remain explicit and cannot be silently promoted.",
    "Stroke path indices document geometry-to-component alignment only, not handwriting instruction.",
    "Each record is independently sourced, publicly distributable and versioned where appropriate."
  ],
  "classes": [
    {
      "id": "Language",
      "group": "language",
      "definition": "An identified language as a linguistic system."
    },
    {
      "id": "LanguageVariety",
      "group": "language",
      "definition": "A regional, social, or standardized variety of a language."
    },
    {
      "id": "Script",
      "group": "writing",
      "definition": "A conventional collection of written graphic signs; not a language."
    },
    {
      "id": "WritingSystem",
      "group": "writing",
      "definition": "Conventions for using a script to represent a language or its units."
    },
    {
      "id": "Orthography",
      "group": "writing",
      "definition": "A documented set of spelling and character-use conventions for a language variety."
    },
    {
      "id": "Text",
      "group": "writing",
      "definition": "Preserved source writing with its original sequence of characters."
    },
    {
      "id": "TextSpan",
      "group": "writing",
      "definition": "A source-addressable span of written text with explicit offsets."
    },
    {
      "id": "Grapheme",
      "group": "writing",
      "definition": "A contrastive graphic unit defined relative to a writing system."
    },
    {
      "id": "Character",
      "group": "writing",
      "definition": "An abstract written character; distinguished from Unicode encoding and a rendered glyph."
    },
    {
      "id": "Glyph",
      "group": "writing",
      "definition": "A particular visual realization of a character or written unit in a font or drawing system."
    },
    {
      "id": "GraphicComponent",
      "group": "writing",
      "definition": "A reusable graphic constituent with an explicitly defined identity and normalization policy."
    },
    {
      "id": "ComponentInstance",
      "group": "writing",
      "definition": "A located occurrence of a graphic component inside a particular glyph or decomposition."
    },
    {
      "id": "Decomposition",
      "group": "writing",
      "definition": "A source-attributed structural analysis; may have competing alternatives."
    },
    {
      "id": "RadicalClassification",
      "group": "writing",
      "definition": "A dictionary or standard-specific indexing category, distinct from exhaustive graphic components."
    },
    {
      "id": "OrthographicSegment",
      "group": "phonology",
      "definition": "A token of a particular transcription or spelling system, such as a Pinyin initial or final."
    },
    {
      "id": "Phone",
      "group": "phonology",
      "definition": "A speech-sound realization in a specified phonetic context."
    },
    {
      "id": "Phoneme",
      "group": "phonology",
      "definition": "A contrastive sound unit of a particular language variety."
    },
    {
      "id": "PhoneticFeature",
      "group": "phonology",
      "definition": "An independently defined articulatory or acoustic property."
    },
    {
      "id": "Syllable",
      "group": "phonology",
      "definition": "A syllabic unit within a specified pronunciation analysis."
    },
    {
      "id": "CitationReading",
      "group": "phonology",
      "definition": "A documented out-of-context reading of a written unit."
    },
    {
      "id": "ContextualReading",
      "group": "phonology",
      "definition": "A pronunciation realized in a particular lexical or textual context."
    },
    {
      "id": "ToneCategory",
      "group": "phonology",
      "definition": "A defined tone category under a language-specific phonological analysis."
    },
    {
      "id": "ProsodicFeature",
      "group": "phonology",
      "definition": "A suprasegmental feature or realization, including stress, timing, intonation, or tone contour."
    },
    {
      "id": "Morpheme",
      "group": "lexicon",
      "definition": "A minimal meaning-bearing or grammatical linguistic form in an analysis."
    },
    {
      "id": "Lexeme",
      "group": "lexicon",
      "definition": "An abstract lexical entry, not identical to a printed word token."
    },
    {
      "id": "WordOccurrence",
      "group": "lexicon",
      "definition": "An instance of a word in context with optional source offsets and sense resolution."
    },
    {
      "id": "Sense",
      "group": "lexicon",
      "definition": "A source-supported interpretation associated with a lexical unit in context."
    },
    {
      "id": "SemanticFamily",
      "group": "lexicon",
      "definition": "A justified grouping of meanings or forms, not an identity color by itself."
    },
    {
      "id": "EncodingScheme",
      "group": "visual",
      "definition": "A versioned policy mapping specified information domains into visual representations."
    },
    {
      "id": "Palette",
      "group": "visual",
      "definition": "A versioned registry of color assignments and related accessibility metadata."
    },
    {
      "id": "VisualAssignment",
      "group": "visual",
      "definition": "One typed mapping from a declared linguistic target to a visual value or symbol."
    },
    {
      "id": "VisualLayer",
      "group": "visual",
      "definition": "A configurable channel connecting an information domain to an independently selected presentation mode."
    },
    {
      "id": "RenderedSpecimen",
      "group": "visual",
      "definition": "A concrete rendered example with source, scheme, layer state, and review status."
    },
    {
      "id": "Source",
      "group": "evidence",
      "definition": "An identified external or internal evidence source with revision and licensing context."
    },
    {
      "id": "Evidence",
      "group": "evidence",
      "definition": "A traceable support item connecting a source to a bounded claim."
    },
    {
      "id": "Claim",
      "group": "evidence",
      "definition": "An asserted interpretation or observed result with epistemic status and support."
    },
    {
      "id": "Experiment",
      "group": "research",
      "definition": "A reproducible comparison of encoding conditions, hypotheses, and outcomes."
    }
  ],
  "relations": [
    {
      "id": "hasVariety",
      "domain": "Language",
      "range": [
        "LanguageVariety"
      ],
      "definition": "A named variety belongs to a language.",
      "multiplicity": "0..n",
      "sourceRequired": false
    },
    {
      "id": "usesScript",
      "domain": "WritingSystem",
      "range": [
        "Script"
      ],
      "definition": "A writing system uses a particular script.",
      "multiplicity": "0..n",
      "sourceRequired": false
    },
    {
      "id": "servesVariety",
      "domain": "WritingSystem",
      "range": [
        "LanguageVariety"
      ],
      "definition": "A writing system is defined for a language variety.",
      "multiplicity": "0..n",
      "sourceRequired": false
    },
    {
      "id": "definesOrthography",
      "domain": "WritingSystem",
      "range": [
        "Orthography"
      ],
      "definition": "A writing system has a documented orthographic convention.",
      "multiplicity": "0..n",
      "sourceRequired": false
    },
    {
      "id": "containsSpan",
      "domain": "Text",
      "range": [
        "TextSpan"
      ],
      "definition": "A source text contains an addressable span.",
      "multiplicity": "0..n",
      "sourceRequired": false
    },
    {
      "id": "representsGrapheme",
      "domain": "TextSpan",
      "range": [
        "Grapheme"
      ],
      "definition": "A span encodes an orthographically defined grapheme.",
      "multiplicity": "0..n",
      "sourceRequired": false
    },
    {
      "id": "includesCharacter",
      "domain": "Orthography",
      "range": [
        "Character"
      ],
      "definition": "A character is admitted under a particular orthography.",
      "multiplicity": "0..n",
      "sourceRequired": false
    },
    {
      "id": "hasGlyph",
      "domain": "Character",
      "range": [
        "Glyph"
      ],
      "definition": "A character has a renderer-dependent visual realization.",
      "multiplicity": "0..n",
      "sourceRequired": false
    },
    {
      "id": "containsComponent",
      "domain": "Glyph",
      "range": [
        "ComponentInstance"
      ],
      "definition": "A glyph contains an instance of a reusable graphic component.",
      "multiplicity": "0..n",
      "sourceRequired": false
    },
    {
      "id": "instantiatesComponent",
      "domain": "ComponentInstance",
      "range": [
        "GraphicComponent"
      ],